{
    "NameSpace": "dgt.power.dataverse",
    "Entities": [
        "documenttemplate",
        "systemuser",
        "contact",
        "businessunit",
        "role",
        "savedquery",
        "sla",
        "systemuserroles",
        "asyncoperation",
        "queue",
        "teamtemplate",
        "calendarrule",
        "calendar",
        "documenttemplate",
        "duplicaterule",
        "duplicaterulecondition",
        "routingrule",
        "routingruleitem",
        "team",
        "solutioncomponent",
        "solution",
        "msdyn_componentlayer",
        "workflow",
        "sdkmessageprocessingstep",
        "publisher",
        "importjob",
        "sdkmessageprocessingstepsecureconfig",
        "plugintype",
        "sdkmessageprocessingstepimage",
        "sdkmessagefilter",
        "sdkmessage",
        "pluginassembly",
        "customapi",
        "dependency",
        "account",
        "organization",
        "systemform",
        "processstage",
        "customapirequestparameter",
        "customapiresponseproperty",
        "attribute"
    ],
    "SuppressTypeScript": true,
    "SuppressMetaData": true,
    "SuppressActions": true,
    "UseBaseLanguage": true
}
